position,requirements,description,benefits
Escalations Specialist - Customer/Patient Experience Coordinator - Full Time Contract/Remote,"Must have at least 1 year of experience in escalations department where most or all of your time was spent on de-escalating upset customers and finding solutions for them. Effective communication at a high level and under stress. Calm, confident and empathetic demeanor when handling customer complaints. Ability and eagerness to adapt to a fast-paced environment and learn quickly. A digital native comfortable with technology and development. Experience using a computer in your professional career. A minimum typing speed of 40 words per minute. A passion for excellent customer service and problem-solving. N/A At least 1 year of experience in escalations department Prior experience working remotely / working from home. Prior experience in a venture-backed healthcare or startup/technology setting is an asset. Prior management experience in a hospitality/retail or customer service setting is an asset. Ambition to have a long term career in healthcare is an asset. Experience living in the US or using the US healthcare system is an asset.","Own customer escalations from engagement to resolution creating high quality customer support experiences for our patients. Serve as the primary touchpoint for patients with inquiries, problems or complaints that could not be solved by our patient experience team. De-escalate upset patients quickly, calmly and consistently. Provide feedback to management about customer issues. Advocate for patients and coordinate their care with external organizations such as insurance companies, pharmacies and specialists. Think creatively to solve problems standing in the way of patient experience, care or outcomes. Assist with billing and other insurance issues. Learn the entire patient experience from start to finish to be able to help patients navigate their medical care with ease. Execute complex workflows to ensure high quality patient care and compliance with hippa laws.","In alignment with our values Circle Medical has transparent salaries based on location (San Francisco, Montreal or remote in US) and output levels. This is a full-time contracted position with an hourly compensation of $15 USD per hour."
"Senior Director, Digital Marketing - Remote","5+ years of experience leading digital initiatives including digital strategy, content strategy, SEO, SEM and UX. Primary .com in-house or SaaS experience strongly preferred, agency experience a plus. Expertise in Google Analytics and knowledge of marketing automation for setting up marketing flows and analytics processes. N/A 5+ years of experience leading digital initiatives including digital strategy, content strategy, SEO, SEM and UX Primary .com in-house or SaaS experience strongly preferred, agency experience a plus. Passion for learning and teaching digital trends and best practices.","Responsible for Veeva.com and associated web properties from end-to-end. Work in collaboration with the creative, content and demand generation to create site experience around our customer journeys. Help plan digital aspects of integrated marketing campaigns with the marketing team.",Flexible PTO. Allocations for continuous learning & development. Discounted gym membership.
"Director, Digital Strategy",5+ years of paid performance digital marketing experience. 1+ year in a supervisory role directly overseeing other digital marketing professionals. Experience working with DTC or lead gen clients. Experience forecasting and allocating digital marketing budgets across channels. You are a communication guru when presenting digital marketing strategy to C-Suite and executive audiences. 4 year college degree or equivalent work experience 5+ years of paid performance digital marketing experience. 1+ year in a supervisory role directly overseeing other digital marketing professionals. Comfortable optimizing toward backend metrics from a CRM such as Salesforce.,"Serve as the main point of contact and client team lead for larger multi-million dollar clients with millions in ad spend. Manage 5+ dotted line reports - Sr Account Manager to Team Leads across each account. Directly manage a team of more experienced leads acting as a sponsor on their accounts and a mentor in their career growth. Build, manage and maintain the client relationship. Revenue + retention responsibilities for your accounts. Drive overall account strategy, forecasting and planning for your team. Analyze performance data and KPIs. Lead expansion into new digital paid media channels to facilitate growth.",This role is exempt. Base salary $120-150K. Target annualized cash bonus 15%. Target total cash $140-175K.
Virtual administrative assistant,"Reporting skills, administrative writing skills, Microsoft Office skills, managing processes, organization, analyzing information, professionalism, problem solving, verbal communication High school diploma or equivalent education required Prior administrative assistant experience is important Knowledge of appropriate software including Microsoft Word, Excel and Outlook, Microsoft PowerPoint, and Adobe Acrobat","Answer phone calls, schedule meetings, filing, emailing, typing, scanning, online research, and making telephone inquiries. Provide administrative support to ensure efficient operation of office.",Work from home - no need to visit office. Above average compensation for qualified applicant.
Remote Administrative Assistant,"high school diploma or equivalent, previous administrative experience, history of being deadlinedriven proactive extremely organized and detailoriented, basic knowledge of google docs sheets etc high school diploma or equivalent N/A N/A","scheduling meetings interviews and events, planning and assisting with facilitating companywide events training etc, researching for culture development employee satisfaction etc",Không
REMOTE Data Entry/Auditor,"Experience with Google Sheets, Excel, data entry, auditing, reporting. Strong communication skills. High attention to detail and accuracy. Tech-savvy, able to multitask well. N/A N/A Competitive review experience across brands and retailers. Independent thinker and self-starter. Ownership mindset and ability to creatively problem solve.","You will be responsible for audits, check name pictures and taxonomy. You will research and write descriptions for SKUs. You will creatively problem solve to find and append UPC codes for SKUs.","Pay is $XX/hour based on experience. Benefits include health insurance, retirement plans, and other perks."
Work From Home - BEGIN IMMEDIATELY - Data Entry Clerk,"Computer/laptop/tablet/smartphone, internet connection, ability to work independently, follow written instructions, typing skills, provide feedback N/A Entry level, no experience necessary N/A","Data entry, customer service, product testing, participation in online focus groups",Không
Data Entry Specialist,proactivity and ability to work in a team; marked attention to detail in daily work; previous work experience is a plus; advanced english level N/A N/A N/A,support the recruiting area in the identification and initial contact of potential candidates for our searches; propose new alternatives to identify candidates; identify opportunities for improvement in the current processes of the area; manage the notices in the different job portals with which we work and evaluate the candidates that apply to them; identify and analyze professional profiles in job portals for the different searches we have open,remote work; hardware setup for you to work from home; flexible hours- make your schedule; paid parental leave vacation holidays; diverse and multicultural work environment; an innovative environment with the structure and resources of a leading multinational; excellent compensation - well above the market average; here you can grow at the speed of your learning curve
Software Developer- Entry Level,Basic software development and testing skills. Ability to build applications and interfaces based on requirements. Knowledge of software QA processes. Communication skills to work with teams and clients. High school diploma or GED required. No need for higher education or college degree. Entry-level opportunity suitable for those without prior professional experience. N/A,"Develop software and solutions for clients using appropriate software technologies. Build, test, and maintain interfaces, code, and applications. Participate in troubleshooting and requirements analysis. Design and configure integrations between systems.","Full-time salaried role with benefits including medical, dental, vision."
Business Analyst (Entry Level),"Masters degree in computer science, computer engineering, or any related field of study. Exposure in agile, waterfall methodology. Job duties are projectbased and performed on longterm assignments at various unanticipated sites within the US which may require relocation at the end of each project. Masters degree in computer science, computer engineering, or any related field of study N/A N/A","Assist in the planning, design and development of new applications and enhancements to existing applications. Meet with decision makers, systems owners and endusers to define business requirements and systems goals and identify and resolve business systems issues. Ensure compatibility and interoperability of in-house computing systems. Review and analyze the effectiveness and efficiency of existing systems and develop strategies for improving or further leveraging these systems acquisition, deployment. Assist in the deployment of new applications and enhancements to existing applications. Create system design proposals. Perform costbenefit and return on investment analyses for proposed systems to aid management in making implementation decisions. Create systems models, specifications, diagrams and charts to provide direction to system programmers. Coordinate and perform in-depth tests including enduser reviews for modified and new systems. Provide orientation and training to endusers for all modified and new systems. Other duties as assigned.",Không
Entry Level Office Assistant,"Organizational skills, attention to detail, teamwork, positive attitude, accounts receivable experience preferred but not required N/A Entry-level N/A","Applying customer payments, writing refund checks, invoicing customers, printing and preparing invoices/statements, providing customer service, reviewing invoices, taking payments over the phone","Competitive compensation and comprehensive benefits package including health, vision, dental, disability, life insurance, PTO, and paid holidays"
Software test Engineer ( Entry Level ),"Good working knowledge of test management software, programming languages, and QA methodologies. Good team working and critical thinking skills. N/A N/A N/A",Designing test plans scenarios scripts and procedures. Executing tests on source code. Analyzing test results and reporting to the development team. Working with the development team to correct bugs and errors.,Không
Satellite TV Installer - Entry Level,"High energy, resourcefulness and ability to multitask. An eye for opportunities to sell customers on new personalized technology. Strong customer advocacy skills - friendly, communicative with a high degree of integrity. Sales, electrical, maintenance/repair, cable, military and/or customer service experience preferred. N/A N/A N/A","Install and manage customer products while creating opportunities to sell them on new personalized technology. Relocate power and place mounts, satellite dishes, televisions, routers, cameras, receivers and whole-home connectivity technology in customer homes. Conduct site surveys and in-person home assessments.","$18.00 per hour plus a promotion at 6 months with a $2.00 per hour pay increase. Paid incentive with potential for up to $5,000 in your first year and $10,000 each year after that based on your performance. Paid time off - 5 vacation and 5 sick time. Free DISH TV programming at a value of $30/month at your home plus deeply discounted SlingTV and Boost Mobile plans. Paid training, tools and uniforms."
"Sales Associate (Entry Level) Phoenix, AZ","Bachelors degree; Less than 2 years of experience; Strong relationship orientation and strategic thinking skills; Strong oral and written communication skills; Demonstrated flexibility and willingness to be coached and developed; Willingness to train in another territory for 6-9 months (housing will be provided); Must be willing to relocate anywhere in the US upon promotion; Working knowledge of Microsoft Office software including Word and Outlook Bachelors degree Less than 2 years of experience Sales experience (in Pharma or an Associate Rep in Med Device); Demonstrated leadership and teamwork experience (i.e. athletics, extracurricular activities, etc); Demonstrated ability to effectively collaborate with internal colleagues; Ability to prioritize work and meet deadlines; A self-motivating can-do attitude",Train with a territory representative for 6-9 months with housing provided; Assume ownership for several accounts post training with TR for 3-6 months in a territory you will own upon successful completion of training program; Maintain all existing revenue; Attend surgical cases in the operating room; Build pipeline momentum of opportunities; Secure hospital approvals and surgeon support,Competitive compensation; Medical & dental benefits - 100% paid for employee and family members; 401k with 50% matching contributions; Basic life and ADD; Unlimited vacation; 12 weeks paid maternity leave; Being surrounded by talented and engaged employees
Remote Patient Advocate Specialist,High school diploma or equivalent. Customer service/call center experience preferred. Experience with medical coding/billing preferred. Proficient PC and typing skills. Effective communication and organization skills. Ability to multitask and work independently. High school diploma or equivalent. N/A Previous customer service/call center experience. Previous experience with medical coding or billing.,"Contact patients by phone to screen for eligibility for government assistance programs. Initiate applications, provide instructions, ensure deadlines are met. Obtain necessary info from patients, document details in system. Maintain positive relationships with patients. Follow up until all options exhausted or patient approved.",Không
$17.50hr - Patient Advocate - Part Time Position - Mon - Fri ...,Exceptional customer service skills N/A N/A N/A,"Answer incoming calls, make outgoing calls, connect clients to prescription drug assistance programs, assist with day-to-day updates, information requests, documentation updates, contact with clients and healthcare providers, follow established processes, document interactions, update clients, set up and communicate follow up interactions",Không
Member Health Advocate ~ remote,Experience with customized database systems for documentation of member contact status and outcomes. N/A N/A N/A,"Perform inbound and outbound communication with members to address healthcare inquiries, utilization, benefit inquiries, and gaps in care. Support members in disease management activities through interventions. Provide member health education regarding conditions. Field members to appropriate health promotion programs.",Không
Bilingual Care Advocate (Hebrew),"Background in allied health, human services or healthcare; Motivated and ambitious outlook; Dedication to delivering excellent customer service; Problem-solving skills; Enthusiasm to work independently and collaboratively; Excellent written and verbal communication skills; Empathy for patients N/A N/A Experience working with sensitive health information; Experience in social work, nursing, public health or related field; Experience in insurance navigation, claims advocacy or medical billing; Experience working in a fast-paced startup environment; Experience in family planning and maternal-child health areas","Answer user questions about the product, provide online appointment booking support, triage urgent care requests, provide ongoing case management, conduct video appointments with members, relay member insights","Generous PTO, employer-covered health, dental and insurance plans, access to mental health, reproductive health, family planning, pediatrics specialists, professional development stipend, paid parental leave, flexible time upon return, new parent stipend"
Remote Customer Service Representative,Customer service skills. Ability to communicate effectively. Basic computer skills. Attention to detail. Product knowledge. High school diploma or equivalent. 1-3 years of experience. Insurance industry experience. Experience with insurance tracking databases.,"Respond to customer inquiries and requests via phone, email, and mail. Resolve routine issues and escalate more complex ones. Process transactions on customer accounts. Maintain and update customer account information in databases.","Competitive pay. Medical, dental and vision benefits (full-time). 401k plan. Paid time off and holidays."
Retail Cashier & Sales Floor Support - The Shops at Riverwalk Rack,"Enthusiasm, sense of adventure, accountability, initiative, high level of ownership, organizational skills, attention to detail, ability to prioritize multiple tasks, calm demeanor in a busy retail environment, solid math, verbal and written communication skills, ability to work a flexible schedule based on business needs N/A N/A N/A","Keep the customer experience quick, easy and fun while helping customers. Create a smooth fitting room experience by greeting customers and taking them to their fitting rooms. Share your love of fashion and tell customers about upcoming events, gift cards, rewards program and mailing list. Keep the stockrooms organized and complete all inventory processes, making sure merchandise is properly checked in and accurately ticketed. Work with the team to ensure the sales floor stays clean through remerchandising and straightening throughout the day.",Không
Restaurant Team Member - Cashier,"Friendly, motivated, hardworking, up for a challenge, ready to grow, great communication skills. N/A N/A Food service/retail experience.","Ring up orders quickly and accurately, know the menu, help customers with questions or requests, deliver excellent customer service.","Competitive pay, eligible for quarterly increases based on performance, free meals on shifts, career growth opportunities, paid vacation & holidays for fulltime team members, medical dental vision life insurance vacation & k with match available."
Retail Floor Leader - Anthem,"Retail, restauran, or hospitality experience. N/A N/A N/A",Conducts opening and closing operational routines as needed ensuring a successful start or completion of the stores daily business. Executes detailed comprehensive stock and product management routines including processing shipment and completing markdowns merchandising replenishment and fulfilling online orders. Welcomes guests and assists with finding their perfect pair accessories or apparel. Keeps an overview to daily operations and troubleshoots any concerns with transactions and store routines.,Không
Medical Assistant,"Excellent oral and written communication skills and empathy towards patients, ability to effectively collaborate with team members including doctors, nurses, front desk staff, center managers and market leaders, mindset focused on solving problems for patients and achieving team goals, knowledge of medical products, services, standards, policies and procedures, skill in operating phones, personal computer software and other IT systems, detail-oriented to ensure accuracy of reports and data, ability to maintain effective and organized systems to ensure timely patient flow, ability to act calmly in busy or stressful situations High school diploma or equivalent, graduate from a nationally accredited medical assistant program or equivalent healthcare preparation (i.e. foreign-trained physician, paramedic, etc.) One year medical assistant or similar work experience in corresponding setting is preferred, experience working with geriatric patients is a plus, EMR system experience is preferred CPR for healthcare providers is required","Measures and records vital signs, records patient interview history and chief complaint, prepares patients for examinations and performs routine screening tests, assists physician with exams, explain treatment procedures and physicians instructions to patient, phlebotomy and collection of other lab specimens, performs basic waived lab tests, prepares and administers medications under physician supervision, changes dressings, applies bandages, removes sutures and other first aid procedures, uses CPR skills when necessary, maintains supplies equipment stocks and sterilizes instruments, practices OSHA safety standards, performs accurate legal and ethical documentation at all times, processes patient phone messages returning calls and routing them to other team members as appropriate, calls patients to obtain and relay pertinent information for the physician, upon physician approval and authorization calls in prescriptions to the pharmacy, uses communication skills with appropriate medical terminology and follows appropriate legal and ethical professional conduct, authorized individuals will use the ChenMed Rx system to support physician medication dispensing, performs other related duties as assigned",Không
Medical Receptionist,Valid medical assistant certification (AAMA or FL CNA license). Valid CPR certification. High school diploma or GED required. Minimum 2 years medical assistant experience. Orthopaedic experience a plus. Proficiency with triaging patient care issues. Ability to work efficiently in a fast paced clinic. Knowledge of HIPAA and safety guidelines/regulations. Excellent communication and customer service skills. Computer proficient. High school diploma or GED required Minimum 2 years medical assistant experience Orthopaedic experience a plus,"Work closely with orthopedic physicians and physician assistants to coordinate the care and needs of patients. Assist with clerical duties such as completing forms and charting. Check physician schedules and prepare charts for needed test results. Organize patient flow to keep physician on schedule. Assist patients to exam room, collect patient history and conduct screening per physician guidelines. Record patients medical history, vital statistics or information such as test results in medical records.",Không
Medical Receptionist / Registrar,"Typing skills, computer literacy, healthcare/hospital experience preferred, bilingual a plus N/A N/A Bilingual a plus","Register patients, schedule appointments, answer phones, provide customer service",Union position with benefits offered including dental and medical
Sales Associate/Beauty Advisor,"Passion for beauty, customer service skills, communication skills, sales ability N/A N/A N/A","Build relationships and inspire loyalty, recommend products, inform customers of promotions and events, set up displays and arrange merchandise, ensure customers are enrolled in loyalty program, complete transactions, maintain store environment, communicate inventory issues","Product discount, free samples, medical, dental, vision, vacation, sick days and holidays for full time employees"
Part-Time Retail Sales Associate,"Hospitality mentality, ability to build rapport with customers, complete transactions accurately, promote loyalty programs N/A N/A Retail or service industry experience, excellent communication skills, curious and eager to learn, values diversity","Engage and connect with customers, provide excellent customer service, offer product information, execute operational processes to drive sales",Không
"Program Manager, Blended Learning","Experience leading complex programs, projects or products; demonstrated skill facilitating stakeholder engagement; demonstrated skill successfully executing metrics-based programs; experience in education, educational technology or human resources preferred; ability to adapt processes and deliverables when necessary; excellent communication skills both verbal and written; ability to make detailed information understandable; ability to juggle several projects, manage time efficiently and prioritize appropriately N/A 5+ years of experience managing complex initiatives, programs, projects or products Experience incubating and launching new products, services or businesses and an entrepreneurial mindset; experience developing or delivering cohort-based learning services","Lead multiple related programs from ideation through delivery; drive systemic change through influence, action and process definition; establish and measure KPIs to set and measure program direction, execution and evaluation; identify cross-product synergies, dependencies and capabilities; implement stakeholder management among programs and projects; maximize stakeholder involvement across multiple programs through engagement and communication; identify market and user research needs across programs and facilitate collection and application; lead multiple tiger teams; provide weekly program updates and monthly steerco updates; develop rollout roadmaps; facilitate organizational transformation and communication; support financial modeling, planning and reporting; support incubation of new initiatives and programs; participate in gathering user research and requirements; evaluate and mitigate program risks; provide status reporting, documentation and communication",Không
