position,requirements,description,benefits
Apple Solutions Consultant,a passion to help people understand how apple products can enrich their livesexcellent communication skills allowing you to be as comfortable in front of a small group as you are speaking with individuals years preferred working in a dynamic sales andor results driven environment as well as proven success developing customer loyaltyability to encourage a partner team and grow apple business N/A years preferred N/A,as an asc you will be highly influential in growing mind and market share of apple products while building longterm relationships with those who share your passion customer experiences are driven through you and your partner team growing in an ever changing and challenging environment you strive for perfection whether its maintaining visual merchandising or helping to grow and develop your partner team,Không
Licensing Coordinator - Consumer Products,"2+ years experience in preferably outbound licensing. Understanding of category manufacturing and sales cycles for toys/food/beverage preferred. Experience with entertainment/lifestyle brands. Self-starter, proactive, flexible. Thrives under pressure. Superb organizational and multitasking skills. Excellent communication skills. N/A 2+ years experience in preferably outbound licensing Understanding of category manufacturing and sales cycles for toys and/or food and beverage preferred. Experience working with reputable entertainment and/or lifestyle brands.","Help drive business by supporting licensing managers on tasks related to category management, facilitating information between stakeholders, maintaining communication plans. Coordinate with internal teams to share brand and marketing updates with partners. Maintain and update title strategies and licensing plans. Collaborate with partners on product launches. Assist with licensing recaps, meetings, and agreements.",Không
Web Designer,"2+ years experience in web design. Proficiency with Adobe Creative Cloud (Photoshop, Illustrator, InDesign). Strong HTML, CSS, JavaScript skills. Familiarity with content management systems. N/A 2+ years UX/UI design experience. Knowledge of brand standards and guidelines.","Designing websites, wireframes, landing pages, and mobile applications. Implementing designs using HTML, CSS, and JavaScript. QA testing sites and applications.",Không
Web Developer,"2+ years of experience with HTML and CSS/SASS, 2+ years of experience with programming PHP applications and LAMP stack development, experience with ES6 JavaScript and jQuery, thorough understanding of relational databases and security relating to PHP/MySQL, expert knowledge with content management systems either from your own design or from MVC frameworks such as Zend, Laravel etc., ability to build and consume custom SOAP and REST APIs, 2+ years of experience writing unit tests detailing procedures, self-motivated requiring minimal supervision, exceptional organization and communication skills N/A 2+ years N/A","Build and layouts from provided PSD files, build dynamic web apps using PHP/MySQL frameworks, leverage REST services and other third-party APIs, rapidly solve problems/bugs and compatibility issues, troubleshoot test and maintain the core product software and databases","Free health insurance for employees with no waiting period, dental and vision insurance (Trackfive splits the cost), paid birthday holiday, company-paid short and long-term disability insurance, company-paid life insurance, flex time, paid parental leave, company-matched retirement plan with no waiting or vesting period, work-from-home options, office perks like snacks/massages/pet days, opportunity to work with great people on exciting things, amazing holiday party"
Frontend Web Developer,"Strong attention to design details, typography, UI, etc. Familiarity with Bootstrap or similar frameworks. WordPress knowledge. N/A N/A Desire to learn WordPress.",Translate designs responsively for multiple screen sizes. Work in WordPress. Frontend web development.,Không
Remote Website Designer,"2+ years experience in web or product design. Portfolio showcasing typography, interaction and visual design skills. Understanding of responsive design and modular design systems. Figma and design tools proficiency. Strong communication skills. Self-starter. N/A 2+ years experience as an individual contributor on a web or product design team Personal projects displaying design aesthetic and passions. ADA and accessibility certification. Experience facilitating visual design adoption. Ability to communicate design decisions.",Provide design support for client and internal website projects. Collaborate with content and development teams. Ensure high-quality implementation of designs. Use and evolve the design system.,Remote work. Generous PTO. Education/training allowance. Apple hardware. Insurance benefits. Company-sponsored life insurance.
Web Designer,"2+ years of digital design experience driving online sales or marketing. Ability to communicate effectively with high-level clients. Able to thrive in a fast-paced, team environment. Open to new ideas and able to adapt quickly. Proficiency with Adobe Creative Suite including Photoshop, Illustrator, and InDesign. Experience with Sketch and UI wireframing. Ability to articulate design concepts. HTML/CSS/JS experience preferred but not required. N/A 2+ years of relevant digital design experience HTML/CSS/JS experience",Design compelling direct response websites and digital content that supports the brand campaign objectives and drives measurable actions. Utilize knowledge of company products and services to create effective designs. Create designs compatible across devices. Create mockups and present ideas to stakeholders. Continually improve user experiences and drive revenue growth.,"Competitive salary, monthly profit distributions, health/dental insurance paid 100% by company, 401k matching, generous paid time off, potential for remote work"
Web Designer,"3+ years experience as a web designer. Experience with creative production tools like Figma and Adobe Suite. Strong project management skills. Clean aesthetic and typography skills. Strategic thinker with passion for brand building and UX. Flexibility to work on multiple brands at once. N/A 3+ years experience as a web designer Experience working with creative production teams. Learning mindset committed to continuous improvement. Bias toward action, efficiency and adaptability. Success testing and uncovering insights.","Work on various website designs and ongoing monthly improvements for 5 clients. This includes testing CTAs, remediating core pages, adding landing pages, refining pricing pages, updating user flows, redesigning blogs, etc. Guide website project timelines, scopes and costs within the Tuff process.","$110,000-$150,000 salary range. Comprehensive health, dental and vision coverage. 401k with matching. Unlimited PTO. Parental leave. Home office stipend. Internet reimbursement. Annual team retreats."
Web Developer,"Proficiency in HTML, CSS, JavaScript and basic PHP/MySQL. Experience building and maintaining web-based platforms (WordPress). Knowledge of interaction design fundamentals and web best practices. Experience with Adobe Creative Suite and audio/video editing. API integration experience. N/A At least 2 years of experience building and maintaining websites. Experience with motion graphics. Capacity to rapidly design/develop web pages based on shifting calendars. Aptitude to independently troubleshoot novel coding issues. Enthusiasm to work in a challenging, creative music industry environment.","Design, create and code promotional pages, social skins, email campaigns, banner ads, web interfaces and page layouts. Maintain and update active company and label websites, images, audio files, press releases, graphics. Troubleshoot creative and technical challenges.","Outstanding benefits including 401k match, medical/dental/life/disability insurance."
Senior UI Designer,"UI design experience; Proficiency in design tools like Sketch, InVision, Illustrator; Web/mobile design experience; Pixel-perfect design files; Motion design experience N/A Multiple years of related design experience Design systems experience; Icon/illustration experience; Design community connections; Takes feedback well; Personal design style","Lead or contribute to projects; Create designs that align with client brand, creative vision, and business strategy; Collaborate across teams; Provide art direction",Không
Wordpress Web Developer,"php, wordpress, wp plugins, html, css, java script, mysql, linux, git a bachelors degree in computer science, engineering, information technology or equivalent experience 2 years professional software development experience N/A",design develop and test high quality software features by understanding user needs and implementing well designed code follow and implement the code with standards and best practices,Không
UI Web Designer,"Proficient in Adobe Creative Suite. Ability to prototype designs in interactive formats like Figma, Adobe XD, or Sketch. Understanding of responsive web design and mobile-first principles. Visual design skills including color, layout, typography, and composition. N/A 2 years experience as a UX/UI designer including design, development, implementation, and production deployment. Portfolio of webpage design examples.",Take a key role in the design and layout of our consumer facing webpages. Creating wireframes for initial review by the greater marketing team. Create high-fidelity comps for the visual layout and design of web pages.,Không
CEO,"At least 10 years of senior management experience, prior successful P&L management and/or president or GM experience N/A At least 10 years of senior management experience Prior successful P&L management and/or president or GM experience, entrepreneurial thinker, proven ability to increase profitability through business development","Manage full P&L, develop growth strategy, provide operational management as CEO of acquired companies",Không
CEO Coach,"Strong financial acumen, management skills, and entrepreneurial spirit. Proven experience as a successful business leader and mentor. N/A N/A Experience as a CEO or executive in a variety of industries. Commitment to continual learning and staying up-to-date on leading-edge tools and knowledge.",Lead monthly roundtable discussions and one-on-one coaching sessions with group members. Guide members in making impactful business decisions and connecting them with relevant resources and experts.,Không
Assistant Vice President Premier Relationship Manager,"Experience in a similar client-facing, relationship management role at a bank or financial institution; State insurance license, SI Series 6 securities license, Series 7 securities license N/A N/A N/A","Engaging with clients and prospects in person, on the phone or by email to develop relationships, perform business development, and assist them with financial needs through products and services offered","Competitive pay and benefits including options to improve health, finances, and lifestyle."
Digital Marketing Specialist,"2+ years of direct digital marketing experience, willingness to take on a wide range of responsibilities, 2 years of email campaign management experience, experience with WordPress, Canva, Elementor and email marketing programs N/A 2+ years of experience N/A","create a series of email newsletters, manage social media channels, coordinate work and collaborate with outside marketing and ad teams, design landing pages and site marketing content","Hybrid work schedule, Up to three days per week in the office, Primarily work from home, Columbus OH"
"Performance Marketing Specialist, Paid Media","2+ years relevant experience in paid media/digital marketing for a business or agency, retail experience preferred. Proven ability to analyze, organize and integrate large amounts information into clear, concise presentations and plans. Demonstrated success in delivering efficient traffic and revenue with ROI. Experience working with web analytic tools like Adobe Analytics, Facebook Ads Manager, etc. Intermediate Excel skills for reporting. College degree required in relevant field of study 2+ years Retail experience preferred","Provide support and execution of integrated media campaigns to drive traffic and sales to express.com. Assist with developing optimal media campaigns for lower funnel display and paid social programs. Help manage creative brief/traffic process, develop reporting, and communicate performance.",Không
Software Engineer,"Proficiency in JS, TS, C and other leading-edge technologies and languages. Academic excellence or professional success in computer science, software engineering, or related fields. BSBA or greater in computer science, mathematics, software engineering, computer engineering, or a related field. N/A N/A","Write software for healthcare systems using modern development methodologies, user-centered design, analytics, and machine learning. Invent better ways to reduce medical errors, streamline record sharing, and improve patient care quality.","Comprehensive benefits including merit-based compensation with annual raises and bonuses, stock grants, 4-week paid sabbatical after 5 years, and relocation reimbursement."
Entry Level Software Engineer,College degree (associates or bachelors). Authorized to work in the US. Desire to learn to code. Problem solving skills. Team player. Adaptable. Communication and interpersonal skills. College degree (associates or bachelors). No prior professional experience required. N/A,Training program to become an entry level software engineer. Work on real world projects in a team environment. No prior professional experience required.,Competitive salary. Relocation & housing assistance. Paid time off. Industry certifications. Mentoring program. Experience with large US companies. Career acceleration opportunities.
Software Engineer,"Proficiency in HTML, CSS, JavaScript, ASP.NET, SQL. Experience with front-end and back-end programming languages like JavaScript, Ruby, Java, Go, Swift. Database skills including NoSQL and Node.js. Understanding of HTTP protocols, SSL, web architecture. Experience with Git version control. N/A N/A Strong communication skills. Ability to work in teams. Business mindset and desire to continuously improve.",Develop and maintain client-side and server-side applications. Work with other developers and teams to ensure applications have the right features and functionality. Write tests to ensure software remains functional.,Không
Senior Software Engineer,"5+ years of PHP development experience with modern PHP practices, frameworks and deployment. Proficient with Git, Linux, SSH, the command line and agile methodologies. BS degree in computer science, engineering or related subject. BS degree in computer science, engineering or related subject 5+ years Experience with dynamic DNS, VueJS, Laravel, responsive frontend frameworks like Bootstrap/Foundation, scaling technologies like containerization/microservices, nonSQL databases like columnar stores/graph databases. MS degree in computer science, engineering or related subject.","Develop and deploy new features, procedures and tools. Troubleshoot, test and maintain the core product software and databases. Provide technical leadership to the team.",Không
Warehouse Manager,"High school education or equivalent, minimum five years experience performing warehousing or logistical related activities in a CGMP pharmaceutical manufacturing environment, must have formal leadership experience including direct management of employee related activities, thorough knowledge of hazardous material and transportation regulations and applicable regulatory requirements (FDA, IATA, DOT, Customs and OSHA), in-depth understanding of warehousing operations, logistics, inventory management and inventory control principals, working knowledge of quality system processes (CAPA, change controls), hands-on experience with SAP or similar ERP, demonstrated ability to influence and successfully coach team members, experience developing procedures and other controlled documents, must be highly organized and process oriented, ability to operate warehouse equipment such as forklifts and pallet jacks if needed, strong interpersonal communication and time management skills, thorough understanding of software technologies used in typical warehousing or logistical operation including Microsoft Office applications High school education or equivalent, additional coursework in logistics, business administration or supply chain principals preferred Minimum five years experience performing warehousing or logistical related activities in a CGMP pharmaceutical manufacturing environment N/A","The warehouse manager is responsible for the coordination of all warehousing activities as well as directly managing the flow of inventory into and out of the warehouse. They will provide direct leadership to all warehouse team members and must effectively collaborate with manufacturing, quality, planning and finance in order to meet business objectives.",Không
Warehouse Manager,Ability to lead and motivate a team. Knowledge of warehouse operations and processes. N/A N/A Experience leading teams in a warehouse environment. Knowledge of safety procedures.,Lead and direct the daily activities of warehouse teammates to ensure the safe and successful completion of all related daily warehouse activities and operations. Verify and ensure all applicable warehouse processes are followed.,Không
Warehouse Supervisor,"2+ years of supervisory experience in a warehouse/distribution environment, strong interpersonal and team management skills, mathematical and computer skills, ability to meet deadlines in a fast-paced environment N/A 2+ years of previous supervisory experience required, preferably in a warehouse or distribution center environment N/A","Responsible for directing and overseeing warehouse operations, supervising warehouse personnel, managing daily freight schedules, ensuring proper inventory control and storage procedures, coordinating with other departments, completing reports, resolving discrepancies, executing audits, overseeing product rotation, etc.","Bonus opportunities, career advancement, relocation opportunities, 401(k) with company match, employee stock purchase plan, referral bonus program, corporate discount programs, medical/dental/vision/life insurance"
Warehouse Manager,Able to carry at minimum 50 lbs. Strong organizational and time management skills. Excel proficiency. Ability to drive a box truck. Clean driving record. Ability to pass random drug tests. High school diploma or equivalent preferred. 1 year of warehouse experience required. N/A,"Receiving, inspecting and delivering all shipments. Scheduling and coordinating part-time workers. Scheduling and coordinating deliveries with designers and customers.","$15 per hour. Health insurance, paid time off, 401k, employee discount, flexible schedule."
Warehouse Management Specialist,"Forklift operation, warehousing experience, ability to lift up to 50 lbs, flexibility in schedule High school diploma or equivalent preferred N/A N/A","Day-to-day tasks include loading and unloading trucks and railcars, staging product for orders, rotating product, lifting up to 50 lbs, forklift operation, inbound/outbound freight handling, warehouse operations, and being willing to cross-train in different areas.",Không
"Warehouse Manager - Lexington, KY","Prior warehouse management experience preferred; 2-5 years of previous material-handling experience; Forklift certification and experience driving a box truck preferred; Ability to lead a team and/or work one-on-one with our customers; Ability and willingness to lift boxes and specific building materials weighing as much as 100 lbs; Strong customer service skills; Ability to work successfully under the pressure of deadlines and to accept new ways of doing business; High integrity, high energy and a positive attitude; Ability to navigate technology to schedule deliveries and manage inventory N/A 2-5 years of previous material-handling experience preferred Prior warehouse management experience preferred; Forklift certification and experience driving a box truck preferred","Manages all warehouse operations including personnel; Handles all aspects of inventory management; Manages the loading and unloading of exterior building products such as siding, windows and gutter; Coordinates shipments to ensure deliveries are on time and accurate; Works alongside warehouse associates in loading/unloading trucks; Hires and manages warehouse personnel; Approves associates schedules to minimize overtime; Establishes bin locations; Oversees daily cycle counts for inventory accuracy; Verifies accuracy of orders picked and shipments received; Knows how to a forklift; Keeps warehouse clean and orderly","Medical, dental and vision coverage; Company paid life insurance and disability; Industry leading 401(k); Paid holidays; Paid vacation time; Health and wellness program; Generally no weekend work-normal hours Monday-Friday 7am - 5pm"
Warehouse Supervisor,Warehouse operations management. Shipping and receiving procedures. Inventory control and management. Leadership and team supervision. Supply chain logistics. Organization and multitasking. Communication skills. N/A N/A N/A,"Oversee supervision of the warehouse team and effective operation of packing, shipping, receiving, and inventory. Support the branch manager in safe, efficient and economic running of the warehouse. Oversee and participate in the preparation of items for shipping, receiving, storing, and inventory. Oversee and participate in incoming and outgoing shipping activities to ensure accuracy, completeness and condition of shipments, which includes lifting and carrying materials. Review records for accuracy and compliance with established procedures. Review shipping discrepancies as needed and work to rectify problems with relevant team members. Conduct inventory counts. Order warehouse supplies when needed. Develop and maintain an effective department, assist in the selection, training, motivation and review of team members. Perform other related duties as assigned.",Không
Bank Teller,"Retail/customer service experience, communication skills, math aptitude, computer/Microsoft Office skills. High school diploma or equivalent. N/A Prior banking/financial services experience.","This role involves providing excellent customer service, processing transactions accurately and efficiently, identifying customer needs and cross-selling products, adhering to policies and procedures.","Competitive compensation, health insurance, 401K with employer match, paid vacation/sick days, employee discounts on banking products and services, employee referral bonuses."
Bank Teller,No specific technical or soft skills mentioned. Ability to work weekday daytime shifts is required. N/A No prior experience necessary. Will train applicants. N/A,"Day-to-day tasks include working regular weekday shifts, such as 9am to 5pm or 8am to 4pm. No weekend hours required.","Pay is $12 per hour. Benefits include 401k with matching, dental insurance, health insurance, life insurance, vision insurance."
Bank Teller,"Previous cash handling experience, customer service experience, strong communication skills and basic computer skills N/A N/A N/A",The bank teller will process transactions accurately and efficiently in a fastpaced environment while introducing products and services that meet the customers needs,The bank teller can earn medical dental and vision coverage and so much more. Estimated salary to $15 per hour based on qualifications.
Seasonal Teller,"Basic math, computer, oral/written communication skills. Judgement, integrity, ability to handle confidential information. Quick and accurate working style, analytical thinking, decision making. Ability to operate standard office equipment. High school diploma or equivalent. Cash handling and customer service experience preferred. N/A","Provide teller services such as handling deposits/withdrawals, payments, greeting customers, maintaining accounts. Engage with customers to explore needs and recommend appropriate products/services. Make referrals to other business units when suitable.",Không
Bank Teller,Excellent interpersonal and communication skills N/A N/A N/A,"Handling routine financial transactions, balancing cash drawer, crossselling banking products, providing excellent customer service",Estimated salary to $XX per hour based on qualifications. Benefits like medical dental vision k and more.
Bank Teller,"Strong customer service skills, attention to detail, basic math and computer skills, ability to handle cash accurately. High school diploma or equivalent. No experience required. Previous banking experience, experience with banking software.","Handling customer transactions, answering questions, cashing checks, accepting deposits and loan payments, processing paperwork, maintaining accurate records.","Pay is $15 per hour. Benefits include 401k with 6% matching, dental and health insurance, life insurance, and vision insurance."
Sales Executive III Client Management,"Extensive experience as a sales executive in fintech or financial services, at least 5 years of experience interacting and partnering with senior management, understanding of investment banking operations technology and change landscape N/A At least 5 years N/A","Sell products and services, manage relationships, ensure alignment of client technology and business strategies, focus on account retention and continued revenue growth",Competitive salary and benefits
