position,requirements,description,benefits
"Regional Sales Director, SAP - NE - United States","Ability to call on C-level executives, strong contact and networking base, excellent listening, writing, and presentation skills, sense of urgency and strong work ethic, self-motivated and accountable to forecast and quota, highly energetic and able to work independently in addition to being a strong team player, strong interpersonal and influencing skills, strong verbal and written communications skills N/A N/A IT infrastructure and hosting knowledge a plus","Prospecting in territory, pursuing qualified leads, meeting quarterly revenue targets",Không
Licensed Insurance Agent Remote Executive Sales Manager,"Insurance license or ability to acquire one. Sales experience preferred. Proficient computer and communication skills. Ability to establish rapport over the phone. N/A Sales experience preferred. Ambitious, business/entrepreneurial mindset. Team-oriented and system-driven. Passion for helping others.","Utilize our lead generation system, direct-to-consumer link, and digital dialer to connect with clients and determine their insurance needs. Submit business weekly. Maintain a lead inventory to generate new clients.","Commission only. Bonuses and benefits like exclusive leads system, discounted health insurance, free life insurance, and personal mentorship."
VP of Finance (East Meadow),"5+ years of experience in public accounting. 3+ years of experience in accounting and finance in a startup or highly entrepreneurial environment. Experience with financial statement preparation, budgeting, forecasting and internal control implementation. N/A 5+ years in public accounting. 3+ years in a startup or entrepreneurial environment. Experience partnering with executives to drive strategic financial decisions. Best-in-class analytical skills. Strong business and financial acumen. Flexible and adaptable style.","Perform regular financial analysis, accounting, budgeting and forecasting. Prepare timely and accurate financial statements and monthly closes. Enhance and implement financial and accounting systems, processes, tools and controls.",Competitive salary and bonus. Equity incentives. Platinum health insurance. 401k with company match. Additional insurance and educational stipends. Flexible work policies.
Director - FP&A / Corporate Finance,"5+ years of strong FP&A experience. Bachelors degree. Experience with FP&A modeling, budgeting, forecasting and planning. Previous experience in a leadership and/or supervisory role. Solid analytical, mathematical and research skills. Great interpersonal skills. Excellent communication skills (written and verbal). Strong attention to detail. Highly organized. Bachelors degree 5+ years N/A",Own FP&A budgeting processes including creating ongoing process beginning with monthly updates. Build concrete path to becoming EBITDA positive and profitable. Run ad hoc scenario analysis. Run scenario analysis for M&A exploration over different time periods and assumptions. Run all financial analytics. Perform other duties as needed.,Không
"Associate Director, Global Capital Markets Documentation, GBM...","Minimum 5 years industry experience and relevant legal background in derivatives and trading documentation including prime services documentation and a strong understanding of the provisions in such documentation. Basic understanding of prime services products. Law degree from a reputable law school and membership in a bar association. Excellent communication, legal drafting and organizational skills. Strong business acumen, sound judgment and critical thinking skills. Must be action-oriented and self-motivated with strong relationship management skills. Ability to work collaboratively with team members and internal stakeholders in particular legal, tax, banking front office, credit and operations to ensure GCMD objectives are met. Law degree from a reputable law school and membership in a bar association Minimum 5 years industry experience N/A","Manages a complex international portfolio of negotiations in relation to the bank and its affiliates capital markets documentation including legal drafting and providing detailed analysis and advice to internal stakeholders on any nonstandard client requests or contentious issues. Exercises discretionary authority to address or escalate decisions with respect to such documentation and escalates matters to banking front office, legal, credit, operations, tax or other areas as appropriate.",Không
Furniture Product Sales Liasion,"Design and retail furniture sales experience for a manufacturer, or interior design experience. Strong coordination skills. Thorough understanding of furniture. N/A N/A Experience designing and selling unique, high-end furniture pieces and home accessories.",Implement ways to gain exposure and increase sales for their furniture/home goods area. Work with store managers and put together incentives ideas to increase traffic and interest. Support the sales team. Coordinate with the wood shop and retail stores ordering products.,Không
"Manager, Data Analytics","Experience with data analytics, reporting, visualization, and building analytics platforms. Proficiency in relevant data analytics software and tools. N/A N/A N/A","Implement and maintain a trusted scalable and efficient data analytics platform to drive data democratization through reporting and visualization. Work with all sales channels and key internal stakeholders to define, develop and centralize data into an omni reporting platform while enhancing the user experience.",Không
Data Analyst Manager,"5+ years experience in data management, analytics and transformation; Proficiency in SQL, Python N/A 5+ years Financial services background",defining and managing data models and data dictionaries to support data and analytics platforms,"Competitive, based on experience"
Senior Data Analyst,"SQL, Python, Excel, GitHub, Google Sheets, experience with analytics and BI tools like Looker, Tableau, PowerBI, Google Data Studio, statistical analysis and data science skills. N/A 5+ years of relevant work experience in data analysis, business analysis, engineering, consulting, statistics, mathematics or other analytical roles. Experience with databricks, Jupyter Notebook, R or other scripting languages, working in fast-paced environments, presenting technical concepts to varied audiences.","Establish business intelligence and data analytics infrastructure, generate insights through exploring data sets, build dashboards and visualizations, lead data projects, collaborate with engineers and product teams, provide analysis and recommendations to clients based on data.",Không
Analytics Manager,ba or bs degree; demonstrated experience thinking strategically about issues leading to recommendations and action plans; years of people management experience; years of experience supporting product business or operations teams in an analytical capacity; demonstrated experience influencing global crossfunctional teams; knowledge in conducting quantitative analysis including sql or python r c ba or bs degree  years of people management experience;  years of experience supporting product business or operations teams in an analytical capacity degree in computer science math physics engineering statistics or other technical fields or equivalent professional experience; knowledge in statistics eg hypothesis testing regressions or computer science; experience teaching and guiding others in quantitative concepts; experience communicating complex topics to technical and nontechnical audience,manage and coach a team of data analysts to have big results through career skill and personal development especially technical mentorship; drive data discovery and leverage findings to improve our partners experience and increase our impact; become a trusted partner for product and engineering teams and understand how your team can help contribute to driving our overall quality and measurement mission lead the team to identify trends and influence change; apply structured thinking to advance the strategy and execution of the org across our base of partners,Không
Marketing Analytics Manager,Proficiency in analytics and ability to synthesize data insights. Strong communication skills to present insights to marketing team and executives. N/A N/A Experience with marketing analytics and campaign performance analysis. Knowledge of trends in marketing analytics space.,"Bringing together data, analytics and insights across channels, teams and tools to uncover insights and tell a story that shapes strategy. Preparing weekly, monthly and quarterly reports analyzing performance. Developing models for attribution, forecasting, and lead/pipeline movement.",Không
"Sr. Product Marketing Manager - Growth, Music Industry","2+ years of experience with end to end product delivery, experience owning roadmap strategy and definition, experience owning feature delivery and tradeoffs of a product, experience with product cycles of 6-12 months, 2+ years of experience in product or program management, product marketing, business development or technology N/A 2+ years experience in growth marketing for a digital or tech company with an emphasis on leveraging ABM (account based marketing) strategies aimed at sourcing and progressing pipeline to drive business Proven ability to initiate and drive complex projects with minimal guidance and then communicate insights with senior stakeholders, experience with Salesforce Marketing Cloud and Sales Cloud and/or similar products, you have owned growth marketing channels and driven demonstrable results owning and achieving core growth and engagement KPIs, you understand marketing funnels and know how to optimize and drive each stage, extremely organized with strong project management skills with a bias towards action and proactive communications, experience working with product and engineering teams influencing roadmaps, an understanding of the music ecosystem & the value chain, the key players, what motivates them and how they operate is a plus but not required","Design and operate a sales and marketing leads pipeline with support from product and engineering. This includes requirements building, marketing automation to enable lead acquisition, nurturing and conversion including lead grading and scoring, and day-to-day sales/marketing ops.",Không
"Marketing Program Manager, B2B","2+ years of successful business-to-business B2B marketing experience, preferably in the ecommerce, retail, technology, SaaS, or software industries. Proficient analytical skills including Microsoft Excel. Experience working with legal, product, and internal business owners to reach mutually beneficial agreements. Experience prioritizing and managing multiple responsibilities. N/A 2+ years of experience BABs degree preferred. Proven ability to execute and exceed on all core goals and secondary KPIs.","Identify and scale high ROI mass communications to Amazon Business sellers using marketing best practices. Collaborate with cross-org stakeholders to source content, segment audiences, and execute effective email and webinar go-to-market motions. Be the strategic owner of multiple Amazon Business flywheel themes with the goal of increasing theme adoption rates while automating repetitive processes.",Không
Project Management Administrator,"Minimum 2 years experience in design/construction, familiarity with design documents and construction phases, computer literacy including MS Office and Bluebeam N/A Minimum 2 years in design or construction Experience as executive assistant, project architect/engineer/manager, located in NYC area","Attend project meetings, provide meeting followup, manage calendars, serve as document controller, support diversity plan execution, interface with project admin",Không
Nurse Administrator,"registered nurse license, scrubbing and circulating operating room experience or preop/pacu experience within a surgery center, acls pals and bls certification N/A nursing - 1 year preferred, supervising experience - 1 year preferred, surgery center - 1 year preferred, scrubbing and circulating operating room - 1 year preferred, preop/pacu in surgery center - 1 year preferred, leadership - 1 year preferred previous experience working in a surgery center","overseeing surgical operations and workflow, staff scheduling, patient scheduling, assisting to build the nursing team and current employee education, ensuring state and regulatory compliance, updating policy procedures and preparing any material for aaahc or any other upcoming accreditations or survey, contributes to and works with physician committees",health insurance
Administrative Assistant,"High school diploma or GED. Minimum of 3 years experience as an administrative assistant and/or medical secretary. Proficiency in Microsoft Word, PowerPoint, and Excel. Knowledge of Microsoft Access a plus. Ability to communicate effectively with others. Excellent oral and written communication skills. Computer knowledge including word processing skills (Microsoft Word). General administrative background with good organizational skills. High school diploma or GED Minimum of 3 years experience as an administrative assistant and/or medical secretary Experience as an administrative assistant and/or medical secretary preferred.","Assist in the overall operation of Rikers Island. Provide secretarial support to the on island administrator. Handle payroll related questions and pregenerate time keep records. Maintain data and/or informative reports on logs and databases. Handle a high call volume, receive and disseminate important information related to medical services. Collect and disseminate medical related information to inmates/patients. Other duties as assigned.",Không
Site Administrative Assistant,"Experience as an administrative professional, proficient in MS Office Word, Excel, Outlook, PowerPoint, excellent customer service skills, verbal and written communication skills, organizational skills, attention to detail N/A N/A N/A","Support site management with employee programs and services, read and route incoming mail, organize and maintain filing system, answer and screen phone calls, schedule appointments and meetings, arrange travel, conduct research and prepare reports, prepare correspondence, order supplies, support payroll operations, support HR functions like recruiting and onboarding",$14 per hour
Senior HR Business Partner,"5+ years of HR/people experience with 2+ years of experience as an HR business partner. Experience partnering with sales teams and sales leadership. Ability to think critically and anticipate issues before they arise and proactively suggest long-term solutions. Excellent judgment and ability to make sound decisions independently. Exceptional ability to prioritize and manage time effectively. Comfortable working with data and analytics, able to turn data into insights and compelling stories. Outstanding communicator with relationship-building skills. Owner mentality. N/A 5+ years of HR/people experience with 2+ years of experience as an HR business partner N/A","Coach leadership on people strategy including team structure, organizational design, strategic hiring, performance management, compensation, recognition and learning and development. Partner with leadership to define, execute and track progress against org-specific people strategy objectives (OKRs). Empower managers to build amazing teams through leadership development. Assess employee development needs and recommend solutions. Lead client groups through DoorDash’s people programs like engagement surveys, performance reviews, compensation reviews, talent development, etc. Partner with the culture, belonging and people growth team to effectively execute our diversity, equity and inclusion strategy. Be a key contributor to reimagining or upleveling companywide people programs such as the performance review process, employee voice survey and manager development training.",Không
HR Generalist,"2+ years of HR coordinator or HR generalist experience. Highly collaborative. Strong verbal and written communication skills. Highly detail-oriented, excellent organizational skills and ability to prioritize effectively. Strong critical thinking skills and ability to propose meaningful solutions. Highly analytical with advanced Excel skills. Able to identify gaps and drive operational improvements. Excellent judgment and discretion maintaining confidentiality. Flexible mindset and ability to navigate ambiguity. Action-oriented and able to work independently with minimal supervision. Knowledge of California employment laws and regulatory requirements. N/A 2+ years of HR coordinator or HR generalist experience Knowledge of employment laws and regulatory requirements in states/countries beyond California.","Partnering cross-functionally to drive and manage process and system improvements that will improve the employee experience, increase the efficiency of the HR team, keep us compliant and improve the quality of our data. Acting as the first point of contact for employees with people operations questions. Onboarding new hires. Administering benefits programs. Processing HR documentation.",Không
Federal - Nursing Assistant Inpatient Mental Health West,CNA or nursing assistant certification. Understanding of safety/infection control procedures. Compassion and patience working with patients. High school diploma or equivalent. Completion of a state-approved CNA training program. N/A Experience in inpatient mental health or psychiatric care. Strong communication skills.,"Provide basic patient care under direction of nursing staff. Maintain patient rooms, equipment, supplies. Assist patients with activities of daily living.",Không
Nursing Assistant (Inpatient Mental Health),"Ability to provide a range of patient/resident care and contribute to the completion of the nurse care plan and recovery of patients/residents. Ability to observe patients’/residents’ physical or emotional status and refer deviations and/or problems to supervisor in a timely manner. Ability to properly use equipment, materials and supplies in simple diagnostic and treatment procedures. N/A Must possess at least one year experience in mental health inpatient or outpatient. Preferred experience must possess at least two year experience in mental health inpatient or outpatient.","Provide quality nursing care to a variety of patients whose age may range from 18 years to over 100 years. Provide complete personal hygiene care needs. Turn and position patients to maintain proper body alignment. Lift, ambulate and transfer patients. Promote the physical independence of the patient by encouraging and teaching individual patients and groups of patients in self-care activities. Prepare patients for meals, feed and assist those requiring assistance. Take and record vital signs, weights, neurological checks and circulatory checks.",Không
Sylmar Certified Nursing Assistant CNA for Psychiatric lockdown...,Certified Nursing Assistant (CNA) certification required. Strong communication and interpersonal skills. Ability to work well under pressure in a fast-paced environment. CNA certification required. N/A Experience working in mental health or psychiatric facilities preferred.,"Provide support and care for patients in a psychiatric facility. This may include monitoring patient behavior, assisting with daily living activities, administering medications, and ensuring a safe environment.","Up to $30/hour. Full-time employees are eligible for health insurance, dental, vision, disability benefits."
Nursing Assistant (Inpatient Mental Health),"Knowledge and experience providing nursing care in an inpatient setting, communication skills, ability to lift/move patients N/A Minimum 2 years nursing experience preferred Experience in mental health or psychiatric care","Perform nursing care duties under the direction of an RN, including: personal hygiene assistance (bathing, oral care, etc), turning and positioning patients, lifting/transferring patients, taking vital signs, feeding patients, assisting with bladder training, providing emotional support, observing and reporting on patient status",Không
Nurse Practitioner - Icu Davies - Pd,Working knowledge of the healthcare industry safety precaution policies best practices regarding patient care and privacy and changes in localstatefederal regulations; possess written and verbal communications skills to explain sensitive information clearly and professionally to diverse audiences including nonmedical people; basic knowledge of computer applications such as microsoft office suite word and outlook electronic health record; prioritize and delegate assignments and work within standardized policies procedures and scientific methods to achieve objectives and meet deadlines; work independently as well as be part of the team including accomplishing multiple tasks in an environment with interruptions; identify evaluate and resolve standard problems by selecting appropriate solutions from established options; ensure the privacy of each patient s protected health information phi; build collaborate relationships with peers and other healthcare providers to achieve departmental and corporate objectives Graduate of an accredited school of nursing N/A N/A,"Assesses, diagnoses, plans and implements the medical care of patients in collaboration with a physician; functions within the full scope of licensure accountable for the assessment coordination delivery and evaluation of nursing care including direct patient care patientfamily education and transitions of care; delivers holistic and individualized care to all patients in assigned area; develops implements manages an optimal interdisciplinary plan of care that incorporates psychological sociocultural spiritual economic and lifestyle factors",Không
Real Estate Agent - Training Provided,"Excellent communication, problem-solving, negotiation, and presentation skills. Knowledge of the local real estate market. Proficient with real estate software and technology. New York real estate license or willingness to obtain one. N/A Prior real estate sales experience. Existing client network.","Handling the entire real estate purchase process for clients, including showing properties, negotiating offers, and guiding clients through closing.","Commission-based pay, earning potential of $50,000+ per year. Flexible schedule. Energetic, supportive team environment."
Real Estate Agent - Training Provided,"Real estate license, sales and negotiation skills, communication and networking abilities, work independently, motivated and driven. State accredited real estate license. Open to new and experienced agents. Previous real estate experience, established professional network.","Selling and listing real estate properties, generating leads, showing homes to prospective buyers, guiding clients through negotiations and paperwork.","Commission-based pay with unlimited earning potential, flexible schedule, free training and support."
Realtor,"Real estate license, communication skills, tech savvy. N/A Open to entry-level and experienced agents. N/A","Perform daily duties like showings, open houses, lead follow up, drafting leases, and closing rentals. Act as an intermediary between tenants and landlords.","Competitive compensation with bonus incentives. Benefits include flexible scheduling, branding assistance, crm software, and more."
Real Estate Agent,"Real estate license, sales and communication skills, knowledge of local real estate market. N/A N/A Existing network of real estate agents and clients.","Motivate and lead a team of real estate agents, generate leads, market properties, facilitate real estate transactions.",Generous commission splits. Residuals for agents brought into the company. Ongoing lead generation provided.
Creative Real Estate Agent in Nyc (We Train You),"Real estate license; ability to move quickly around the city to meet clients for many tours; car is preferred; must have an android/iOS device; organized and computer savvy able to keep sales data up-to-date 2 year college degree preferred but not required N/A Hungry, sales-oriented, creative, people-friendly agents who are passionate about real estate or fresh faces willing to learn about real estate; strong time management skills; ability to manage your own schedule",Daily engagement with customers including heavy use of phones to properly qualify and screen customers based on landlord requirements; selecting listings for customers based on their search criteria and move in date; showing apartments for landlord accounts; providing excellent service keeping renters engaged and happy in their touring experience and rental process; following up with customers that have not yet rented regularly to see if they are still engaged with their rental search; gathering information from tours and submit feedback to improve the process for next time,Potential to earn between $1500 to $2500 per week based on performance and season; hands on training department that will get you fully prepared on how to do the job and help you feel confident meeting your first client through weekly training sessions; access to our network of prequalified buyers as well; easy to screen and qualify all buyers and renters as well as closing deals
Real Estate Agent,"Real estate license, sales skills, outgoing personality, self-motivated, multitasking, follow-up skills, communication skills N/A N/A Experience in real estate industry","Listing and selling real estate properties, hosting open houses, coordinating transactions, conducting showings","$20,000 per year, flexible schedule, work from home, commission pay"
